Date,Startup,Industry,Subvertical,City,Investors,Round,Amount
2016-04-03,FTCash,Consumer Internet,Mobile Payments Platform,Kolkata,IvyCap Ventures,Seed Funding,12.7755
2016-04-03,Civilsdaily,Consumer Internet,Civil Services News Aggregator,New Delhi,Manoj Kumar & Other undisclosed investors,Seed Funding,0.0
2016-04-03,Zappka,Consumer Internet,Mobile App discovery and review platform,Gurgaon,"Daman Soni, Rajat Gupta & Others",Seed Funding,8.517
2016-04-03,Tarusa World,ECommerce,Handicraft products eTailer,Mumbai,Mohit Gulati,Seed Funding,0.0
2016-04-03,medECUBE,Healthcare,Healthcare related Services provider,Gurgaon,Artiman Ventures,Private Equity,340.68
2016-07-03,N.O.W,Consumer Internet,Bike Taxi Service & Hyperlocal Delivery App,Noida,"Ruchirans Jaipuria, Anuj Sanghi",Seed Funding,42.585
2016-07-03,Ninjacart,ECommerce,B2B marketplace for Farmers & Retailers,Bangalore,"Accel Partners, Qualcomm Ventures, M&S Partners, Zop Smart",Private Equity,255.51
2016-07-03,Reach,Consumer Internet,Cross Platform P2P file sharing mobile app,Bangalore,"Rebright Partners, Sol Primero, Sudhir Anandarao, Ankur Warikoo, Ankur Singla",Seed Funding,42.585
2016-07-03,Vanity Cube,Consumer Internet,Hyperlocal Beauty Services platform,New Delhi,Unicorn Ventures,Seed Funding,21.2925
2016-07-03,Wooplr,ECommerce,Curated Fashion ECommerce portal,Bangalore,"Naveen Tewari, Abhay Singhal, Amit Gupta, Piyush Shah, Raghunandan G, Rajiv Mehta",Seed Funding,0.0
2016-07-03,Medidaili,Consumer Internet,Medical Support service platform,Bangalore,Undisclosed private investors,Seed Funding,8.517
2016-08-03,Finomena,Technology,Credit Worthiness Big Data Analytics,New Delhi,Matrix Partners India,Private Equity,0.0
2016-08-03,Cookaroo,Consumer Internet,Food Delivery Platform,Bangalore,Vijay Krishna Yadav,Seed Funding,0.0
2016-08-03,vPhrase Analytics,Technology,AI based data analytics platform,Mumbai,"Apoorv Ranjan Sharma, Daud Ali and others",Seed Funding,0.0
2016-08-03,LoveCycles,Consumer Internet,Women\\xe2\\x80\\x99s health Tracker,Bangalore,Prime Venture Partners,Seed Funding,63.8775
2016-08-03,Kartrocket,ECommerce,ECommerce SAAS platform,New Delhi,"Undisclosed Japanese investor, Bertelsmann India Investments, Nirvana Digital India Fund, Nirvana Digital Investment Holding Co Ltd, 500 Start-Ups",Private Equity,681.36
2016-08-03,dunzo,Consumer Internet,Daily Task Management App,Bangalore,"Aspada Investment Advisors, Blume Ventures.",Seed Funding,55.3605
2016-09-03,Indiamart,ECommerce,B2B Marketplace for SMBs,Noida,Amadeus Capital,Private Equity,0.0
2016-09-03,SmartVizX,Technology,Virtual Reality Solutions,Noida,"Indian Angel Network, Stanford Angels, Entrepreneurs India",Seed Funding,42.585
2016-09-03,MyGubbi,Real Estate,Interior Design & Home D\\xc3\\xa9cor Solutions,Bangalore,"Vipul Parekh, ajesh K Murthy,",Seed Funding,212.925
2016-09-03,Nukkad Shops,Consumer Internet,Hyperlocal Grocery Delivery Service,Hyderabad,PurpleTalk Inc,Seed Funding,85.17
2016-09-03,Cloudacar,Consumer Internet,Carpooling Mobile App,Pune,"Amit Choudhary, Anuj Puri",Seed Funding,0.0
2016-09-03,Justride,Consumer Internet,Self Drive Car Rental,Mumbai,Dheeraj Jain & Other angel investors,Seed Funding,34.068
2016-09-03,Yana,Consumer Internet,Personal AI Transaction Engine App,Gurgaon,"Puneet Gupta,",Seed Funding,0.0
2016-10-03,Big Fish Ventures,Food & Beverage,premium dining lounges Chain,New Delhi,Undisclosed investors,Private Equity,945.387
2016-10-03,Stylflip,ECommerce,Pre-Owned Fashion marketplace mobile app,Mumbai,"Raj Gala Shah, Zaheer Memon",Seed Funding,0.0
2016-10-03,Icertis,Technology,Contract Management Software Solutions platform,Pune/Seattle,"Ignition Partners, Greycroft Partners, Fidelity Growth Partners India",Private Equity,1277.55
2016-10-03,Supplified,ECommerce,Construction material eTailer,New Delhi,Mohit Goel,Seed Funding,85.17
2016-11-03,JollyFoodFellow,Technology,Food Related Marketing & Branding platform,Ahmedabad,Janak Parikh,Seed Funding,0.0
2016-01-02,Blue Tokai Coffee,ECommerce,Specialty Coffee Etailer,New Delhi,Snow Leopard Technology Ventures,Seed Funding,0.0
2016-02-02,Altizone,Technology,IoT & M2M Solutions,Pune,"Wipro Ventures,\\xc2\\xa0 Lumis Partners",Private Equity,340.68
2016-02-02,Oust App,Consumer Internet,Competitive Exam Preparation Platform,Bangalore,"T V Mohandas Pai,\\xc2\\xa0 Aarin Capital",Seed Funding,0.0
2016-02-02,Strike,Consumer Internet,Mobile Email productivity tool,Bangalore,Multiple investors through Ten Minute Million competition,Seed Funding,1.916325
2016-02-02,Gamooz,Technology,Augmented Reality Solutions,Gurgaon,Multiple investors through Ten Minute Million competition,Seed Funding,1.916325
2016-02-02,SoundSurround,Technology,Audio Technology Solutions,Mumbai,Multiple investors through Ten Minute Million competition,Seed Funding,1.916325
2016-03-02,Mazkara,Consumer Internet,Beauty & Wellness Platform,Pune / Dubai,Dunamis Ventures Pte Ltd.,Seed Funding,85.17
2016-03-02,RoadGods,ECommerce,Auto Spare Parts eTailer,New Delhi,Green House Ventures (GHV),Seed Funding,8.517
2016-03-02,Pindropmusic,Consumer Internet,Music Discovery Mobile App,Noida,Green House Ventures (GHV),Seed Funding,8.517
2016-03-02,Woodpie,Consumer Internet,Book Recommendation Service,Bangalore,Ingram Content Group,Seed Funding,2.5551
2016-04-02,Perfumery,ECommerce,Fragrances & Perfume eTailer,New Delhi,Oranda Global & Others,Seed Funding,2.5551
2016-05-02,Magic Crate,Education,Children Education Platform,Bangalore,"TV Mohandas Pai, Aarin Capital",Seed Funding,0.0
2016-05-02,ZenDrive,Technology,Safe Driving Data & Analytics platform,Bangalore / SFO,"Sherpa Capital, Nyca Partners and Thomvest Ventures",Private Equity,1149.795
2016-05-02,Smartcooky,ECommerce,Marketplace for Health Foods,New Delhi,"Vandana Luthra,",Private Equity,0.0
2016-05-02,Turtlemint,Consumer Internet,online personalized insurance platform,Mumbai,Nexus Venture Partners,Private Equity,0.0
2016-05-02,BHIVE,Real Estate,Workspace Rentals,Bangalore,"Raghunandan G, Venturesity, Arihant Patni",Seed Funding,0.0
2016-05-02,Gingercrush,Ecommerce,Personalized Products & Merchandize eTailer,Vadodara,"Saha Fund, TV Mohandas Pai, Zia Mody, Mumbai Angels, Ananda Kallugadde, Rakesh Desai, Rakesh Malhotra",Private Equity,85.17
2016-05-02,American Vision,Consumer Internet,Optical Store Aggregator Platform,Pune,Undisclosed investors,Seed Funding,6.89877
2016-05-02,DawaiLelo,Consumer Internet,Healthcare Services & Online Pharmacy Mobile App,Varanasi,Undisclosed investors,Seed Funding,4.42884
2016-06-02,Heads Up For Tails,Ecommerce,Pet Products eTailer,New Delhi,Undisclosed investors,Seed Funding,85.17
2016-06-02,LiveNutriFit,Healthcare,Weight loss & Healthcare Info portal,New Delhi,"Mohit Goel, Vinod Jain & Others",Seed Funding,0.0
2016-08-02,Moglix,Ecommerce,Industrial & Home Products Marketplace,New Delhi,Ratan Tata,Private Equity,0.0
2016-08-02,iStyleYou,Consumer Internet,Personal Fashion Stylist App,Gurgaon,Green House Ventures (GHV),Seed Funding,8.517
2016-08-02,AdUrCup,Consumer Internet,Ad Network,New Delhi,Green House Ventures (GHV),Seed Funding,8.517
2016-08-02,Weddingz,Consumer Internet,online marketplace for wedding venues and vendors,Mumbai,Sixth Sense Ventures,Private Equity,0.0
2016-08-02,Urban Dhobi,Consumer Internet,On Demand Laundry Services,Jaipur,"Vinod Bansal, Sanjeev Singhal",Seed Funding,0.0
2016-08-02,Gray Routes,Consumer Internet,Last mile logistics solutions,Mumbai,"Mahesh Parasuraman, Rahul Gautam & Others",Seed Funding,0.0
2016-08-02,Xpressbees,ECommerce,ECommerce Logistics solutions,Pune,"SAIF Partners, IDG Ventures India, Vertex Ventures, Valiant Capital",Private Equity,1064.625
2016-08-02,Invictus Oncology,Healthcare,Cancer therapeutic Info & Solutions,New Delhi,Ratan Tata,Private Equity,0.0
2016-08-02,Hansel.io,Technology,Mobile App Tech Solutions,Bangalore,"Endiya Partners, Mekin Maheshwari, Rajesh Sawhney",Seed Funding,0.0
2016-09-02,Inc42,Consumer Internet,Startup Focused Media News Portal,New Delhi,"India Ventures, Aarin Capital & Others",Seed Funding,0.0
2016-09-02,GOQii,Technology,Personalized fitness coaching & Fitness band,Mumbai,Edelweiss Financial Services,Private Equity,0.0
2016-10-02,Capzest,Consumer Internet,Digital Lending Platform,Mumbai,Lion Ventures,Seed Funding,17.034
2016-10-02,GlamStudios,Consumer Internet,Online Salon Aggregator,Noida,Aqeel Ahmed,Seed Funding,0.0
2016-10-02,Affimity,Consumer Internet,Social Networking platform,Bangalore,undisclosed investors,Seed Funding,102.204
2016-10-02,Anandakanda,Technology,Medicine Intake Reminder System,Pune,undisclosed investors,Seed Funding,12.7755
2016-10-02,JoulestoWatts,Technology,IT services & Talent collaboration services startup,Bangalore,Manipal Global Education Services,Seed Funding,0.0
2016-10-02,Shopkirana,Consumer Internet,Retailer Supply Chain platform,Indore,"Atul Jain, Anil Gelra, Jaikumar Nair",Seed Funding,0.0
2016-10-02,Stylofie,Consumer Internet,Online Beauty Parlour search & discovery Platform,Gurgaon,Jaideep Mehta,Seed Funding,0.0
2016-10-02,OyBob,eCommerce,Hyperlocal Products & Services marketplace,Gurgaon,Sachin Dalal,Seed Funding,0.0
2016-12-02,ActOnMagic,Technology,Cloud Analytics and Management Products,Bangalore,Jayabalan Subramanian,Seed Funding,10.64625
2016-12-02,Bonhomia,Food & Beverage,premium Tea and Coffee,New Delhi,"Alok Rawat, Grey Orange Robotics",Seed Funding,85.17
2016-12-02,iGrenEnergi,Technology,Solar Power Solutions,Mumbai,Sunil Mehta,Seed Funding,85.17
2016-12-02,RKSV,Consumer Internet,Online Stock Trading Platform,Mumbai,Kalaari Capital,Private Equity,340.68
2016-01-01,Smartcooky,ECommerce,Health Food / Personal Care Marketplace,New Delhi,"Rajan Anandan, Pramod Bhasin, Siddharth Pai, TV Mohandas Pai, Manvinder Singh Banga",Seed Funding,0.0
2016-01-01,Helpi,Consumer Internet,On Demand Cleaning Services Mobile App,Mumbai,Undisclosed Investors,Seed Funding,0.0
2016-04-01,DogSpot,ECommerce,Online Pet Store,Gurgaon,Ratan Tata,Seed Funding,0.0
2016-04-01,Career360,Education,College Education Portal,New Delhi,MeritTrac,Private Equity,0.0
2016-04-01,B9 Beverages,Food & Beverage,Craft Beer manufacturing company,New Delhi,"Sequoia Capital, Kunal Bahl, Rohit Bansal, Deepinder Goyal, Ashish Dhawan, Mayank Singhal",Private Equity,511.02
2016-05-01,WIMWI Foods,Food & Beverage,Healthy food manufacturing & sales startup,Ahmedabad,Centre for Innovation Incubation and Entrepreneurship (CIIE),Seed Funding,0.0
2016-05-01,MyChild App,Education,Child Disorder Information & Education,Bhopal,"Samir Bangara, Anisha Mittal, Amit Gupta, Pallav Nadhani, Lalit Mangal, Arihant Patni, Dr. Ritesh Malik, Deobrat Singh, Saurab Paruthi, Singapore Angel Network.",Seed Funding,8.517
2016-05-01,Instaproc,ECommerce,B2B Procurement Marketplace for Office Products,Noida,Dinesh Agarwal,Seed Funding,0.0
2016-05-01,360Ride,Consumer Internet,Ride Sharing platform,Bangalore,Undisclosed,Seed Funding,12.7755
2016-05-01,Alef\\nMobitech,Consumer Internet,Cloud Mobility Solutions,Mumbai,Tata Capital Innovation Fund,Private Equity,425.85
2016-06-01,Tracxn,BFSI,Startup Funding Deal Discovery & Execution platform,Bangalore,Ratan Tata,Seed Funding,0.0
2016-06-01,Qdesq,Real Estate,Branded Workspaces Aggregator,Gurgaon,"Dheeraj Jain, Jagdish Kumar, Bharat Gupta, Ankush Saigal, Praveen Saini",Seed Funding,0.0
2016-06-01,Sensara,Technology,"TV Search, Guide and Remote mobile app",Bangalore,"Lalitesh Katragadda,\\xc2\\xa0 Ganayantrika Systems",Seed Funding,63.8775
2016-06-01,Zebpay,Consumer Internet,Bitcoin Buying & Selling Mobile App,Ahmedabad,"Arjun Handa, Amit Jindal, Nagendra Chaudhary",Private Equity,85.17
2016-06-01,PlanMy\\nMedicalTrip,Healthcare,Medical Tourism platform,Pune,"Bhanu Vikram Parsotam, Rohan Desai and Paras Patel",Seed Funding,12.7755
2016-06-01,MyCity4Kids,Education,Children Education & Information platform,Gurgaon,"SIDBI Venture Capital Limited, YourNest Angel Fund",Private Equity,255.51
2016-06-01,Justdakhila.com,Education,School Student admissions platform,New Delhi,Ankur Gupta,Seed Funding,63.8775
2016-07-01,PitStop,Consumer Internet,Automobile Service Booking App,Bangalore,Myntra/LivSpace Founders,Seed Funding,0.0
2016-07-01,Bikxie,Consumer Internet,Two Wheeler Taxi Service,Gurgaon,Undisclosed Investors,Seed Funding,0.0
2016-07-01,Infurnia,Consumer Internet,Online Furniture Customization platform,Bangalore,Idein Ventures,Seed Funding,13.6272
2016-07-01,Myly,Education,Mobile Based Education platform,Jaipur,Newbie Promoter Pvt Ltd,Seed Funding,8.517
2016-07-01,MakeMyTrip,Consumer Internet,Online Travel/Hotel Booking platform,Gurgaon,Ctrip.com International Ltd,Private Equity,15330.6
2016-08-01,Melorra,ECommerce,Online/ Mobile Jewellery Retailer,Bangalore,Lightbox Ventures,Private Equity,425.85
2016-08-01,ConfirmTKT,Consumer Internet,Train PNR Status Prediction Platform,Bangalore,"Krishna Jhujhunwala, Dr. Apoorv Ranjan Sharma, Anirudh Damani, Anand Ladsariya, Sanjay Mehta & Others",Seed Funding,21.2925
2016-08-01,Gyaanzone,Education,Career Planning and Education Advisory Platform,Mumbai,GBIM Technologies Pvt Ltd,Seed Funding,3.83265
2016-08-01,FlatFurnish,Consumer Internet,Online Furnishing Rental Platform,Gurgaon,Arun Chandra Mohan,Seed Funding,0.0
2016-09-01,Lumiere,ECommerce,Organic Food eTailer,Bangalore,Undisclosed investors,Private Equity,0.0
2016-11-01,Koovs,ECommerce,Online Fashion Apparel Retailer,Gurgaon,"Nahata Family, Waheed Alli",Private Equity,459.918
2016-11-01,Wishup,Consumer Internet,Mobile app based Concierge Service,New Delhi,"500 Startups, Mato Peric, TracxnLabs",Seed Funding,0.0
2016-11-01,FreshMenu,Consumer Internet,Online / Mobile Food Ordering platform,Bangalore,"Zodius Capital, Lightspeed Venture Partners",Private Equity,1405.305
2016-11-01,SavvyMob,ECommerce,Last Minute Hotel Bookings mobile marketplace,Bangalore,"TV Mohandas Pai, LetsVenture",Seed Funding,85.17
2016-11-01,Fashionablyin,Consumer Internet,Mobile based Geo-target Fashion Marketplace,Mumbai,Ranjan Mahtani,Seed Funding,0.0
2016-12-01,Shopclues,ECommerce,ECommerce Marketplace,Gurgaon,"GIC, Tiger Global Management, Nexus Venture Partners",Private Equity,8517.0
2016-12-01,Hike Messenger,Consumer Internet,P2P Messaging Service,New Delhi,"Matt Mullenweg, Adam D\\xe2\\x80\\x99Angelo, Aditya Agarwal,\\xc2\\xa0 Ruchi Sanghvi & Others",Private Equity,0.0
2016-12-01,iBus Networks,Technology,Next Generation in-building connectivity,Bangalore,"Vallabh Bhanshali, N Squared Management LLC, Jagdish & Sandeep Mehta Family Office",Private Equity,195.891
2016-12-01,Happy2Refer,Consumer Internet,Mobile based Referral Platform,Mumbai,"Equity Crest, Vinners, Sparknext",Seed Funding,21.2925
2015-01-12,CollegeDekho,Online Education Information platform,,Jaipur,GirnarSoft,Seed Funding,85.17
2015-01-12,Black White Orange Brands,Brand Licensing Startup,,Mumbai,YouWeCan Ventures,Seed Funding,0.0
2015-01-12,Biteclub,Gourmet Food Discovery & Delivery platform,,Gurgaon,growX ventures,Private Equity,0.0
2015-01-12,Patel Logistics,Transportation & Logistics Platform,,Mumbai,Frontline Strategy,Private Equity,476.952
2015-01-12,Wigzo,Enterprise Marketing Automation platform,,New Delhi,"Aarin Capital Partners, TV Mohandas Pai",Seed Funding,42.585
2015-01-12,Godof Hospitals,Digital Healthcare,,New Delhi,Pankaj Gupta,Seed Funding,170.34
2015-02-12,RoomsTonite,Last Minute Hotel Booking App,,Bangalore,"Lashit Sanghvi, Nikhil Vora, Venkat Vardhan,Mohammed Bin Abdul Rehman Al Khalifa,\\xc2\\xa0 Ralph Berezan, Vissal Mathew,\\xc2\\xa0 Balamurali Krishna",Seed Funding,127.755
2015-02-12,Kaaryah,Womens Fashion Wear Portal,,New Delhi,"The Saha Fund, TV Mohandas Pai",Private Equity,0.0
2015-03-12,Anakage,Product Learning platform,,Bangalore,CIO Angel Network (CAN),Seed Funding,0.0
2015-03-12,EasyKhaana,Online Food ordering & Delivery platform,,New Delhi,Undisclosed investors,Seed Funding,8.517
2015-03-12,Shuttl,App based Bus Pooling Services,,Gurgaon,"Sequoia Capital, Times Internet Ltd & One more Fund",Private Equity,1703.4
2015-03-12,Eckovation,Social Learning Platform,,New Delhi,Chandigarh Angel Network (CAN),Seed Funding,0.0
2015-03-12,Fitcircle,Social Fitness platform,,Mumbai,Beerud Sheth and Ravi Mantha,Seed Funding,0.0
2015-04-12,Applop,On Demand Mobile app developer,,Kolkata,GHV Accelerator,Seed Funding,8.517
2015-04-12,CaRPM,Car Maintenance & Management mobile app,,Gurgaon,GHV Accelerator,Seed Funding,8.517
2015-04-12,NDTV Wedding portal,Online Wedding Marketplace,,New Delhi,CerraCap,Private Equity,1703.4
2015-04-12,Splitkart,Splitting Bills Mobile App,,New Delhi,"Rajesh Sawhney, Anupam Mittal, Dinesh Agarwal, Gaurav Gupta,",Seed Funding,0.0
2015-07-12,Zenatix,IOT Energy Management Analytics platform,,Gurgaon,Blume Ventures,Private Equity,0.0
2015-07-12,Customfurnish,Custom Made furniture e-tailer,,Hyderabad,Agnus Capital,Private Equity,383.265
2015-07-12,Faasos,QSR Chain,,Pune,"ru-Net, Sequoia Capital,\\xc2\\xa0 Lightbox Ventures",Private Equity,2555.1
2015-07-12,Vlurn,eLearning platform,,Mumbai,Vidyadhar Sarfare,Seed Funding,0.0
2015-07-12,Leaf Wearables,Smart Safety Wearable Devices,,New Delhi,"Ajeet Khurana Jinesh Shah, Vikram Chachra, Dr. Aniruddha Malpani",Seed Funding,21.2925
2015-07-12,Coolshare,Cab Sharing service Mobile app,,Mumbai,Gopal Aggarwal,Seed Funding,8.517
2015-08-12,mFicient,Cloud Enterprise Mobility Platform,,New Delhi,Undisclosed investors,Seed Funding,0.0
2015-08-12,HeyBiz,Online Shopping Assistant Mobile app,,New Delhi,Shopclues,Seed Funding,0.0
2015-08-12,Yumist,Home Cooked Food Order & Delivery platform,,Gurgaon,"Unilazer Ventures, Orios Venture Partners, Steven Lurie",Private Equity,170.34
2015-09-12,Jigsaw Academy,Online School for Analytics learning,,Bangalore,Manipal Global Education Services,Private Equity,255.51
2015-09-12,JoeHukum,Chat based personal Assistant App,,Gurgaon,"TracxnLabs, Jitendra Gupta, Prashant Tandon",Seed Funding,0.0
2015-09-12,Voxweb,Picture creation & Social mobile app,,Mumbai,Undisclosed Investor,Seed Funding,29.8095
2015-09-12,Aye Finance,Nonbanking finance company,,New Delhi,"SAIF Partners, Accion",Private Equity,255.51
2015-09-12,JumboBasket,eCommerce returns etailer,,Chandigarh,Chandigarh Angels Network,Seed Funding,0.0
2015-10-12,BlackBuck,Online Freight Services Aggregator,,Bangalore,"Tiger Global Management, Yuri Milner, Apoletto, Accel Partners, Flipkart",Private Equity,2129.25
2015-10-12,HomeStudio,Online Branded Furniture etailer,,Bangalore,Bren Corporation,Private Equity,425.85
2015-10-12,PropheSee,Digital Analytics Platform,,New Delhi,"Indian Angel Network, Stanford Angels, Entrepreneurs India",Seed Funding,42.585
2015-10-12,i2e1,Internet Network Infrastructure Services,,New Delhi,GrowX Ventures,Seed Funding,42.585
2015-10-12,Holisol Logistics,Supply Chain & Logistics Solutions,,New Delhi,CLSA Capital Partners ARIA IV Funds,Private Equity,851.7
2015-10-12,Stay Simple Resorts,Holiday Resort Chain,,Bangalore,"Mr. Sudhir & Ms. Shalini Sethi, Mr. Praveen Someshwar",Seed Funding,0.0
2015-10-12,Paynear,Mobile Point of Sale solutions,,Hyderabad,Mitesh Majithia,Private Equity,212.925
2015-10-12,Chillr,Peer-to-Peer Money Transfer & Recharge App,,Mumbai,"Sequoia Capital, Blume Ventures, Uniqorn Ventures and other",Private Equity,5961.9
2015-11-12,EureQa,Test Automation SAAS platform,,Hyderabad/USA,"Sashi Reddi, Gabriel Investments",Seed Funding,51.102
2015-11-12,LocalCircles,Citizens Engagement Platform,,Noida,Anand Mahindra,Private Equity,0.0
2015-11-12,GetFocus,Indoor Navigation & Analytics Solutions,,Mumbai,Undisclosed investors,Seed Funding,0.0
2015-11-12,UrbanClap,Hyperlocal On-Demand Household Services platform,,Gurgaon,Ratan Tata,Private Equity,0.0
2015-11-12,OnlineRTI,Online RTI application services,,Bangalore,"LetsVenture, Mohandas Pai",Seed Funding,12.7755
2015-11-12,Powerstores,ECommerce Website Creation SAAS platform,,Goa,Extreme Venture Partners\\xc2\\xa0 William Bissell,Seed Funding,0.0
2015-11-12,Weddingz.in,Wedding Venues & Vendors Marketplace,,Mumbai,"Rajan Anandan, Zoya Akhtar, Reema Kagati, Ruchi Narain, Amrish Kumar, Hrishikesh Parandekar",Seed Funding,85.17
2015-11-12,Intelligent Interfaces,Interface development platform for Government officials,,Bangalore,"Sachin Bansal, Binny Bansal",Seed Funding,0.0
2015-02-11,Twigly,Online Food Ordering & Delivery platform,,Gurgaon,"Amit Gupta, Sahil Barua, Mukul Singhal, Tracxn Labs",Seed Funding,17.034
2015-02-11,CityFlo,Bus Aggregation and rental mobile app,,Mumbai,IDG Ventures,Seed Funding,63.8775
2015-03-11,Findyahan,hyperlocal online Services platform,,Noida,Times Group Brand Capital,Private Equity,0.0
2015-03-11,Sabse,WiFi \xe2\x80\x93 first Cloud communication platform,,Mumbai,Ratan Tata,Private Equity,0.0
2015-03-11,Pokkt,Alternate Mobile Monetization platform,,Mumbai,"Segnel Venture, Shinji Kimura, Sundar Chanrai, JAFCO Asia, SingTel\\xe2\\x80\\x99s Innov8, Jungle Ventures, K Ganesh",Private Equity,425.85
2015-03-11,oibanit,Online Food Ordering Marketplace,,Vadodara,"Varun Ahuja, Anubhav Verma",Seed Funding,12.7755
2015-03-11,Stuffed,Quick Service Restaurant & Online Delivery,,Mumbai,Riqueza Capital,Seed Funding,32.79045
2015-03-11,Deyor Rooms,Budget Hotels Aggregator,,New Delhi,Dheeraj Jain & Others,Seed Funding,42.585
2015-03-11,Bidgely,Efficient Energy Management platform,,USA/India,"Constellation Technology Ventures (Exelon Corporation), E.ON, RWE, Khosla Ventures",Private Equity,1413.822
2015-04-11,Shirsa Labs,Digital Intelligent learning platform,,Mumbai,ah! Ventures,Seed Funding,21.2925
2015-04-11,Paytunes,Voice Call incentivization mobile app,,New Delhi,CIO Angel Network,Seed Funding,0.0
2015-04-11,YourDOST,Online Counselling and psychological support platform,,Gwalior,"Phanindra Sama, Aprameya Radhakrishna, Aneesh Reddy, Neeraj Jawalkar, Sanjay Anandaram, Pavan Ongole, Venk Krishnan",Seed Funding,34.068
2015-05-11,BookMyBai,Domestic Help Aggregation platform,,Mumbai,Vineel Nalla & Others,Seed Funding,12.7755
2015-05-11,MyIndianStay,Home Stay & room rentals platform,,Goa,Undisclosed investors,Seed Funding,17.034
2015-05-11,Bobble,Selfie Mobile App,,New Delhi,SAIF Partners & others,Private Equity,0.0
2015-06-11,RepUp,Online Reputation Management Platform,,Gurgaon,Indian Angel Network,Seed Funding,0.0
2015-06-11,Satvacart,Online Grocery platform,,Gurgaon,Undisclosed HNIs,Private Equity,153.306
2015-06-11,POPxo.com,Online content platform for women,,New Delhi,"IDG Ventures India, Kalaari Capital, 500 Startups",Private Equity,170.34
2015-06-11,SparesHub,Online Vehicle Spare Parts etailer,,Pune,"Hyderabad Angels, M&S Partners",Seed Funding,39.1782
2015-06-11,Explara,Event Ticketing platform,,Pune,"Hyderabad Angels, Singapore Angel Network, Ness Wadia",Private Equity,41.7333
2015-06-11,Soothe Healthcare,affordable Personal Healthcare Products,,Noida,Saina Nehwal,Seed Funding,0.0
2015-06-11,Yuvi Hospitality,Premium dining Lounges & restaurants,,Gurgaon,Chandralekha Construction Pvt. Ltd.,Private Equity,1277.55
2015-09-11,AppVirality,Mobile Growth Hacking\\nPlatform,,Hyderabad,"Rajan Anandan, Mike Galgon, Ravi Gururaj, Ashim Mehra,\\xc2\\xa0 Mohit Saxena, Internet Group, TNN Capital and others",Seed Funding,42.585
2015-09-11,iStar Skill Development,Skill Training Startup,,Bangalore,"Michael & Susan Dell Foundation, Unitus Seed Fund",Private Equity,127.755
2015-09-11,BigStylist.com,Beauty and Wellness Marketplace,,Mumbai,Info Edge,Private Equity,85.17
2015-09-11,Zilingo,Marketplace App for Bangkok,,Bangalore/ Bangkok,"Sequoia India, BEENEXT Ventures, Kunal Shah & Sandeep Tandon",Private Equity,161.823
2015-09-11,Didi,On-demand Maids Service Provider,,Mumbai,"Jozef Bardik, Leo Wang Sangeeth Ram",Seed Funding,12.7755
2015-09-11,Skoov.com,eCommerce Product Search Engine,,Mumbai,undisclosed investor,Seed Funding,12.7755
2015-10-11,Chefs Basket,Ready to cook packaged Foods,,Mumbai,"SAIF Partners, Haresh Chawla",Private Equity,511.02
2015-11-11,Gingercrush,Product Customization Platform,,Vadodara,TV Mohandas Pai\\xe2\\x80\\x99s family office,Seed Funding,0.0
2015-11-11,Delight Foods,Branded Food products online sales,,Bangalore,"Lensbridge Capital, Mape Advisory Group, Fireside Ventures",Private Equity,51.102
2015-11-11,6Degree,Talent platform for Fashion professionals,,Goa/Hyderabad,"Centre For Incubation & Business Acceleration (CIBA), Goa",Seed Funding,0.0
2015-11-11,RenewBuy,Auto Insurance Online platform,,Gurgaon,Mount Nathan Advisors Pte Ltd,Seed Funding,42.585
2015-11-11,Grab,Hyperlocal Logistics Service Provider,,Mumbai,Sixth Sense Ventures,Seed Funding,0.0
2015-12-11,Hitwicket,Cricket Management Mobile Game,,Hyderabad,Chennai Angels,Seed Funding,21.2925
2015-01-10,Indifi,Easy Business Loans platform,,Gurgaon,"Accel Partners, Elevar Equity, Pramod Bhasin, Rajan Anandan, Gaurav Dalmia, Abhishek Goyal, Gagan Hasteer , Arun Tadanki",Seed Funding,0.0
2015-01-10,Wydr,Performance based Wholesale Marketplace,,New Delhi,Sandeep Aggarwal,Seed Funding,0.0
2015-01-10,EasyFix,Professional Services Marketplace,,Gurgaon,Axilor Ventures,Seed Funding,0.0
2015-01-10,Muvizz,Movie-on-demand platform,,Singapore,"Ashish Todi, Abhinav Patodia, Kumar Shwetabh",Seed Funding,29.8095
2015-01-10,Abhibus,us ticketing and fleet management platform,,Hyderabad,Paytm (One97 communications),Private Equity,0.0
2015-01-10,Cleartax,Online Income Tax Filing platform,,New Delhi,Paytm (One97 communications),Private Equity,0.0
2015-02-10,Shopalyst,Product discovery & recommendation platform,,Bangalore,Kalaari Capital,Private Equity,170.34
2015-03-10,Chillr,Mobile Payments App,,Mumbai,Sequoia Capital,Private Equity,511.02
2015-05-10,Nykaa,Beauty & Wellness Products e-tailer,,Mumbai,"Harsh Mariwala, Atul Nishar, Dalip Pathak, Michael Carlos",Private Equity,809.115
2015-05-10,Voylla,Fashion jewelry and accessories e-tailer,,Jaipur,Peepul Capital,Private Equity,1277.55
2015-05-10,IndiaLends,Online Consumer Lending platform,,New Delhi,"DSG consumer Partners, Paragon Partners",Private Equity,85.17
