Date,Startup,Industry,Subvertical,City,Investors,Round,Amount
2020-09-01,BYJU’S,E-Tech,E-learning,Bengaluru,Tiger Global Management,Private Equity Round,17034.0
2020-09-01,Mamaearth,E-commerce,Retailer of baby and toddler products,Bengaluru,Sequoia Capital India,Series B,1563.6241062000001
2020-02-01,https://www.wealthbucket.in/,FinTech,Online Investment,New Delhi,Vinod Khatumal,Pre-series A,255.51
2020-02-01,Fashor,Fashion and Apparel,Embroiled Clothes For Women,Mumbai,Sprout Venture Partners,Seed Round,153.306
2020-10-01,Zomato,Hospitality,Online Food Delivery Platform,Gurgaon,Ant Financial,Private Equity Round,12775.5
2019-12-12,Ecozen,Technology,Agritech,Pune,Sathguru Catalyzer Advisors,Series A,511.02
2019-06-12,CarDekho,E-Commerce,Automobile,Gurgaon,Ping An Global Voyager Fund,Series D,5961.9
2019-03-12,Dhruva Space,Aerospace,Satellite Communication,Bengaluru,"Mumbai Angels, Ravikanth Reddy",Seed,4258.5
2019-11-12,Rein Games,Gaming,Real money based gaming startup,Noida,Manipal Education and Medical Group (MEMG),Seed Round,4258.5
2019-12-11,SuperGaming,Video Games,Social gaming platform,Pune,Dream Incubator,Seed Funding,110.721
2019-11-11,eBikeGo,Last Mile Transportation,Electric bike rental,Amritsar,Startup Buddy,Seed,25.551
2019-04-10,Dunzo,Customer Service,Delivery Service,Bengaluru,Lightbox,Series D,3832.65
2019-02-10,Udaan,B2B,Business development,Bengaluru,"Altimeter Capital, DST Global",Series D,49824.45
2019-05-09,FPL Technologies,FinTech,Financial Services,Pune,"Matrix Partners India, Sequoia India",Maiden Round,383.265
2019-04-09,Cashflo,FinTech,Invoice discounting platform and SME lending marketplace,Mumbai,SAIF Partners,Series A,281.061
2019-04-09,Digital F5,"Advertising, Marketing",Digital marketing firm,Mumbai,TIW Private Equity,Private Equity Round,511.02
2019-04-09,3rdFlix,SaaS,Education Technology,Hyderabad,Exfinity Venture Partners,pre-series A,425.85
2019-04-09,75F,IoT,Building automation system,Burnsville,Breakthrough Energy Ventures,Series A,1533.06
2019-04-09,Myelin Foundry,Information Technology,Deep-technology,Bengaluru,Endiya Partners,Seed,85.17
2019-04-09,Atomberg Technology,Consumer Technology,"Consumer Electronics, Home Appliances",Mumbai,A91 Partners,Series A,851.7
2019-04-09,GOQii,Health and Wellness,Wearable Fitness Bands,Menlo Park,Bennett Coleman and Company Ltd (BCCL),Series C,38326.5
2019-03-09,Vyapar App,Accounting,Mobile-based Accounting Software,Bengaluru,"India Quotient, Axilor Ventures",Series A,425.85
2019-01-08,CarDekho,E-Commerce,Automotive,Gurgaon,SC GG India Mobility Holdings LLC,Series C,1703.4
2019-01-08,Progcap,Finance,Supply Chain Management,New Delhi,Sequoia India,Series A,425.85
2019-01-08,Alteria Capital,Finance,VC Funds,Mumbai,"Azim Premji, Binny Bansal",Single Venture,11923.8
2019-01-08,Pine Labs,Information Technology,Last-mile retail transaction technology,Noida,Pine Labs Pte Ltd,Corporate Round,3243.2736
2019-12-08,Meesho,E-Commerce,Social Commerce,Bengaluru,Naspers,Series D,10646.25
2019-02-07,RenewBuy,Finance,Auto Insurance,Gurgaon,"Lok Capital, IIFL Wealth",Series B,1618.23
2019-02-07,Atlan,Information Technology,Big Data,Singapore,WaterBridge Ventures,Pre-Series A,212.925
2019-01-07,WizCounsel,Compliance,Consulting,New Delhi,Kapil Dev,Angel,12.34965
2019-03-07,Ola Cabs,Transport,Cabs,Kormangala,"DIG Investment Ab, Deshe Holdings, Samih Toukan and Hussam Khoury",Series J,85.17
2019-01-07,Uniphore,Artificial Intelligence,Speech Recognition,Taramani,March Capital Partners,Series C,3243.2736
2019-04-07,Daalchini Technologies,Food and Beverage,Digital Vending Machine,New Delhi,Artha Venture,Seed Round,42.585
2019-10-07,"""BYJU\\'S""",EdTech,Education,Bengaluru,Qatar Investment Authority,Private Equity Round,12775.5
2019-11-07,Moglix,E-Commerce,Industrial Tools and Equipments,Singapore,"Composite Capital Management, Sequoia Capital India, Tiger Global Management",Series D,5110.2
2019-10-07,Ezyhaul,Tech,Logistics,Singapore,Undisclosed,Series B,1362.72
2019-10-07,Indus OS,Tech,Smartphone Operating System,Andheri,Ventureast,Series B,489.7275
2019-10-07,HealthAssure,Health Care,Primary care medical network,Mumbai,Blume Ventures,Series A,212.925
2019-09-07,House of Msasaba,Luxury Label,Clothes and Apparel,Mumbai,Binny Bansal,Series A,85.17
2019-08-07,Board Infinity,EdTech,Full-stack career platform,Chembur,Multiple Angel Investors,Angel Round,27.220757850000002
2019-05-06,NoBroker,E-Commerce,Real Estate,Bengaluru,General Atlantic,Series C,4343.67
2019-04-06,Bira91,Food and Beverage,Brewery,New Delhi,Anicut Capital,Debt Funding,851.7
2019-03-06,Avail Finance,Finance,FinTech,Bengaluru,Matrix Partners,Series A,766.53
2019-04-06,BharatPe,Finance,FinTech,New Delhi,Insight Partners,Series B,6387.75
2019-04-06,Recykal,Waste Management Service,Optimization,Hyderabad,"Triton Investment Advisors, Pidilite Industries director Ajay Parekh",pre-Series A,2214.42
2019-03-06,Agara Labs,Deep-Tech,Artificial Intelligence,Bengaluru,Blume Ventures and RTP Global,pre-Series A,212.925
2019-06-06,Chakr Innovation,Energy,Renewable Energy,New Delhi,IAN Fund,Series A,2214.42
2019-10-06,Bolo App,Digital Media,Video Platform,Bengaluru,Nexus Venture Partners,Seed Funding,36.640134
2019-10-06,OkCredit,FinTech,Financial Services,Haryana,Tiger Global Management,Series A,1320.135
2019-06-06,Biz2Credit,FinTech,Online Lending Platform,New York,WestBridge Capital,Series B,4428.84
2019-08-06,Vogo Automotive Pvt. Ltd.,Transportation,Dockless Scooter Rental Company,Karnataka,Alteria Capital,Debt Funding,305.24928
2019-04-06,Leegality,Services,Digital Documentation,Mumbai/Bengaluru,Mumbai Angels,Series A,289.578
2019-06-05,Ola Electric,Transport,Cabs,Bengaluru,Tata Sons,Series A,0.0
2019-06-05,Saahas Zero Waste,Waste Management Service,Optimization,Bengaluru,C4D Partners,Venture - Series Unknown,73.978662
2019-05-05,StyleDotMe,E-commerce,Fashion and Shopping,Delhi,"Indian Angel Network and other angel investors, Innov8 founder Ritesh Malik, Josh Talks founders Supriya Paul and Shobha Banga, and former Hero Corporate president Rohit Chanana",Bridge Round,0.0
2019-01-05,BlackBuck,Transport,Logistics,Bengaluru,"Goldman Sachs Investment Partners and Silicon Valley-based Accel, Wellington, Sequoia Capital, B Capital, LightStreet, Sands Capital and International Finance Corporation,",Series D,12775.5
2019-02-05,Zenoti,Saas,Beauty and Wellness Industry,Hyderabad,Tiger Global Management,Series C,4258.5
2019-12-04,Medlife,E-commerce,Online Medicine,Bengaluru,Prasid Uno Family Trust,Private Equity,1447.89
2019-10-04,Kabadiwala,E-commerce,Waste Management,Bhopal,"Unilever, Beehive Capital Advisor, ABCOM Investments, Parekh Marine Transport,",Private Equity,36.67973805
2019-12-04,Azah,Health and Wellness,Organic wellness,Gurugram,Unnamed angel investors,Seed Funding,17.034
2019-11-04,Setu,Fintech,Banking,Bengaluru,Lightspeed India Partners,Seed Funding,298.095
2019-10-04,Toppr,Edtech,E-learning,Mumbai,Milestone,Debt and Preference capital,538.3442394
2019-10-04,Craftsvilla,E-commerce,Fashion and Apparel,Mumbai,Supera Pte Ltd,Inhouse Funding,208.11246915
2019-10-04,Unacademy,Edtech,E-learning,Bengaluru,Kalyan Krishnamurthy,Seed/ Angel Funding,26.14719
2019-11-04,CleverTap,SaaS,Mobile analytics and marketing,Mumbai,"Sequoia India, Tiger Global Management, Accel Partners",Series B,2214.42
2019-01-02,FleetX,AI,Logistics,Gurgaon,India Quotient and LetsVenture\\xe2\\x80\\x99s Angel Fund,Pre Series A,0.0
2019-08-02,Zilingo,Ecommerce,Fashion & Apparel,India/Singapore,"Sequoia Capital and Temasek Holdings, EDBI, Burda Principal Investments, and Sofina",Series D,19248.42
2019-03-01,CarDekho,Automobile,Online Marketplace,Jaipur,"Sequoia India, Hillhouse Capital, Alphabet\\xe2\\x80\\x99s growth investment arm Capital G and Axis Bank",Series C,9368.7
2019-04-01,Vyome Therapeutics Inc.,Health and Wellness,Specialty pharmaceutical,India/US,"Iron Pillar, Perceptive Advisors, Romulus Capital and Kalaari Capital",Series D,1873.74
2019-04-01,Samunnati Financial Intermediation & Services Pvt. Ltd,Finance,Non-banking financial company,Chennai,"MASSIF, a Dutch government fund",Debt-Funding,425.85
2018-04-12,Manch,Social Media,Hyperlocal Content,Delhi,Stellaris Venture Partners,Seed Funding,59.619
2018-01-12,UrbanClap Technologies Pvt. Ltd,Services Platform,Home services marketplace,New Delhi,Steadview Capital and Vy Capital.,Series D,4258.5
2018-02-12,Guiddoo,Travel Tech,Platform for travel agents,Mumbai,Individual Investors,Pre-Series A,68.136
2018-02-12,Career Anna,Online Education,"Video-based certification, trainings",Gurugram,Individual Investors,Pre-Series A,48.71724
2018-04-12,Nagpur Wholesale,Online Marketplace,eCommerce,Nagpur,Omphalos Ventures India LLP,Seed Funding,12.17931
2018-06-12,ShopKirana,B2B,eCommerce,Indore,"Info Edge, AET Fund, Akatsuki and Incubate Fund from Japan and Better Capital AngelList syndicate.",Seed Funding,170.34
2018-06-12,BuildSupply,"SaaS, Ecommerce","Real Estate, ERP",Gurugram,"Venture Highway, GREE Ventures, Space Matrix, Individual Investors",Series A,298.095
2018-01-11,GoDesi,Food and Beverage,Regional Flavours,Bengaluru,Lead Angels Network,Seed/ Angel Funding,11.838204150000001
2018-03-11,Veritas Finance Ltd.,NBFC,MSME Finance,Chennai,"Norwest Venture Partners, CDC Group, the UK\\xe2\\x80\\x99s Development Finance Institution and P Surendra Pai",Series D,2367.64083
2018-06-11,Meesho,Ecommerce,Social Commerce,Bengaluru,"Shunwei Capital, DST Partners and RPS Ventures",Series C,4258.5
2018-08-11,Mobile Premier League,Gaming,Mobile e-Sports,Bengaluru,Undisclosed,Series A,42.585
2018-08-11,A&R Bon Vivants,Food,Meat Retail Chain,Jaipur,"RB Investments, Singapore",Equity,85.17
2018-12-11,Blackbuck,Food Tech,POS For Online Ordering,"New York, Bengaluru",Tiger Global,Series A,85.17
2018-12-11,MilkBAsket,Food,Micro-delivery grocery service,New Delhi,Mayfield Fund,Series B,110.721
2018-01-10,Northmist,Fashion,Mens Wear,Delhi,Prashant Jaiswal,Seed/ Angel Funding,0.0
2018-02-10,Origo Commodities India Pvt. Ltd,Logistics,Supply Chain,Hyderabad,"Cooperative Oikocredit, Caspian and Hivos-Triodos Fund",Seed/ Angel Funding,936.87
2018-04-10,Grover Zampa,Food,Wine,Mumbai,Ravi Viswanathan,Private Equity,698.394
2018-05-10,Droom,Automobile,New and Used Cars Platform,Gurgaon,ZigExN,Series E,255.51
2018-11-10,Innov8,Real Estate,Co-Working,New Delhi,Credence Family Office,Pre-Series A,340.68
2018-12-10,Blackbuck,Logistics Tech,Largest Trucking Platform,Bengaluru,Sequoia Capital India,Private Funding,1250.2956
2018-12-10,LetsTransport,Logistics Tech,Book Trucks Online,Bengaluru,Fosun International,Series C,1022.04
2018-01-09,Netmeds,Consumer Internet,Online Pharmacy Chain,Chennai,"Sistema Asia Fund, Sistema JSFC and Tanncam Investment",Private Equity,2980.95
2018-03-09,Udaan,B2B Platform,Logistics and Shipping,Bengaluru,DST Global and Lightspeed Venture Partners\\xe2\\x80\\x99 global fund.,Private Equity,19163.25
2018-03-09,Daily hunt,Consumer Internet,News and ebooks Mobile App\\xc2\\xa0,Bengaluru,Falcon Edge,Private Equity,544.2363
2018-04-09,HappyGoEasy,Consumer Internet,Online Travel Agecy,Gurugram,"Korea Investment Partners (KIP), Samsung and China-based CITIC Capital and others",Private Equity,0.0
2018-05-09,Nykaa,Consumer Internet,Online Marketplace For Multi-brand Beauty Cosmetic and Wellness Products,Mumbai,Lighthouse,Private Equity,13388.724
2018-05-09,Mad Street Den,Technology,Computer Vision And Artificial Intelligence (Ai) Platform,Chennai,KDDI\\xc2\\xa0,Private Equity,0.0
2018-06-09,Dream11,Consumer Internet,Online Gaming Platform,Mumbai,"Tencent, Kalaari Capital and Private equity firm Multiples Alternate Asset Management",Private Equity,8517.0
2018-10-09,MamaEarth,Healthcare,Online Marketplace For Mother and Babycare Products,Gurugram,Stellaris Ventures & Others,Private Equity,340.68
2018-11-09,AutoGrid,Technology,AI-Based Energy Optimisation and Control Provider,Bengaluru,"CLP Holdings Group, Innogy, \\xc3\\x98rstead, and Tenaska",Private Equity,2725.44
2018-11-09,Pharmeasy,Consumer Internet,Online Marketplace For Pharmaceutical Products,Mumbai,InnoVen Capital,Debt Funding,468.435
2018-11-09,Upwards,Fin-Tech,Online Micro Lending Marketplace,Mumbai,"Shunwei Capital,Quotient, Mayfield & Others",Private Equity,425.85
2018-12-09,Kissht,Fin-Tech,Online lending Platform,Mumbai,"Vertex Ventures Southeast Asia (SEA) and India and Sistema Asia Fund, Fosun RZ Capital, Ventureast, and Endiya Partners.\\n\\n",Private Equity,2555.1
2018-01-08,dishq,Food-Tech,Personalisation Technology Firm Focusing On The Food And Beverage Industry,Bengaluru,"Farm To Fork, Arts Alliance, The Syndicate Fund, Sven Hensen, Zeroth and Artesian Venture Partners",Seed/ Angel Funding,34.068
2018-01-08,HealthFin,Finance,Patient Financing Platform,Pune,"Axilor, Sprout Venture Partners and others",Seed/ Angel Funding,0.0
2018-02-08,Samosa Labs,Consumer Internet,Social Media and Chat Entertainment Platform,Hyderabad,Xiaomi and Sequoia Capital India,Private Equity,596.19
2018-03-08,ZiffyHomes,Consumer Internet,Online Home Rental Marketplace,Gurugram,Y Combinator,Private Equity,10.2204
2018-07-08,ShopX,Consumer Internet,Assisted E-commerce Platform,Bengaluru,Fung Strategic Holdings,Private Equity,2980.95
2018-07-08,MakeMyTrip,Consumer Internet,Online Travel Aggregator,Gurugram,MakeMyTrip Limited,Private Equity,851.7
2018-08-08,Hansel io,Consumer Internet,Real-time Mobile App Management,Bengaluru,Vertex Ventures,Seed/ Angel Funding,340.68
2018-08-08,Metro Bikes,Consumer Internet,Online Bike Rental Marketplace,Bengaluru,"Sequoia Capital India Advisors, Accel Partners and G Raghunandan",Private Equity,1039.074
2018-08-08,Phone Pe,Consumer Internet,UPI Payments App,Bengaluru,Flipkart,Private Equity,5621.22
2018-09-08,quizizz,Ed-Tech,e-learning Platform,Bengaluru,"Nexus Venture Partners, Prime Venture Partners and Others",Seed/ Angel Funding,255.51
2018-09-08,Happy EMI,Fin-Tech,Consumer Financing Platform,Bengaluru,AJ Ventures and Jain International Trade Organisation (JITO),Seed/ Angel Funding,85.17
2018-01-07,Leena AI,Technology,HR Virtual Agent For Employees,Gurugram,Y Combinator,Seed/ Angel Funding,0.0
2018-02-07,Biryani By Kilo,Consumer Internet,Online Food Delivery,Gurugram,Ajay Relan and Vinay Mittal,Seed/ Angel Funding,85.17
2018-04-07,Anchanto,IT,E-commerce Fulfilment Platform,Pune,MDI Ventures & Telkom Indonesia,Private Equity,340.68
2018-06-07,PolicyBazaar,Consumer Internet,Online Insurance Selling Platform,Gurugram,Info Edge (India) Ltd and Temasek,Private Equity,2359.209
2018-09-07,zippserv,Consumer Internet,Online Platform For Risk-Assessment Services For Real Estate Investments,Bengaluru,Info Edge (India) Ltd,Seed/ Angel Funding,37.4748
2018-09-07,Groww,Consumer Internet,Online Platform That Sells Direct Plans Of Mutual Funds,Bengaluru,"Insignia Ventures Partners, Lightbridge Partners & Kairos",Seed/ Angel Funding,93.687
2018-10-07,Avenue Growth,Consumer Internet,Online Platform That Connects Brands With Freelance Sales Professionals,Gurugram,"Avtar Monga, chief operating office at IDFC Bank, Aditya Malik & Others",Seed/ Angel Funding,37.21929
2018-10-07,iNICU,Healthcare,Med-tech Platform Providing Care For Newborns,Delhi,Venture Catalysts,Seed/ Angel Funding,0.0
2018-10-07,Kinara Capital,Finance,Lending Platform For Micro and Small Enterprises,Bengaluru,ResponsAbility,Private Equity,425.85
2018-10-07,Shop 101,Consumer Internet,Mobile Storefront And Commerce Platform For Sellers,Mumbai,"Stellaris Venture Partners, Vy Capital, Raghunandan G, and Ramakant Sharma",Private Equity,425.85
2018-11-07,Sambandh,Consumer Internet,Online Micro Lending Platform,Rourkela,Base of Pyramid Asia (BOPA) Pte Ltd,Private Equity,212.925
2018-12-07,19th mile,IT,Artificial intelligence-based sales acceleration software platform,Gurugram,"Rishi Vasudev, Excelsior Investments, Ritesh Vohra, Praveer Kumar, Prashant Gupta and Others",Seed/ Angel Funding,15.3306
2018-12-07,5th Vital,Healthcare,Home diagnostics services provider,Bengaluru,Brand Capital and Others,Seed/ Angel Funding,42.585
2018-01-06,CoinTribe,Finance,Credit-Based Lending Marketplace For Small And Medium Enterprises,Gurugram,"Sabre Partners, Puneet Dalmia & Others",Private Equity,851.7
2018-04-06,Digiconectt,Technology,Sales Analytics and Enablement Platform,Bengaluru,Aspire Logistics LLC,Seed/ Angel Funding,10.64625
2018-04-06,Kashmir Box,E-Commerce,"Online Marketplace For Handicrafts, Handlooms And Local Produce",Srinagar,"Bhairavi Jani, Alok Divatia, Namrata Kaul, Sohail Hashemi, Aijaz Saleem",Seed/ Angel Funding,0.0
2018-05-06,Crowdera,Finance,Online Crowdfunding Platform,Nagpur,"Anil Advani, Pramod Jain, Amrendra Reddy and Manish Satnaliwala.",Seed/ Angel Funding,0.0
2018-05-06,Zoctr,Healthcare,Online Healthcare Aggregator,Mumbai,NB Ventures and Others,Seed/ Angel Funding,0.0
2018-07-06,Annapurna Finance,Finance,Non-Banking Financial Company,Bhubneswar,Oman India Joint Investment Fund (OIJIF),Private Equity,1958.91
2018-07-06,Meesho,Consumer Internet,Online Marketplace For Resellers,Bengaluru,"Sequoia Capital India, SAIF Partners, Y Combinator and Venture Highway",Private Equity,979.455
2018-10-06,AyeFinance,Finance,Online Lending Platform,Gurugram,"CapitalG, SAIF Partners and LGT Impact Ventures",Private Equity,1831.155
2018-11-06,Theranosis,Healthcare,Specialised diagnostics Platform,Hyderabad,Mumbai Angels Network,Seed/ Angel Funding,0.0
2018-12-06,Alpha Capital,Finance,Supplychain Finance,Mumbai,Alpha Capital,Private Equity,1260.516
2018-12-06,eshakti,E-Commerce,Fashion e-tailer,Chennai,Paragon Partners,Private Equity,860.217
2018-12-06,Daily Ninja,Consumer Internet,Hyperlocal Delivery Platform,Bengaluru,Saama Capital and Sequoia Capital,Seed/ Angel Funding,255.51
2018-02-05,OpenTap,Finance,Online Lending Platform,Chennai,Unknown High Net-Worth Individuals,Seed / Angel Funding,38.3265
2018-02-05,Bizongo,Consumer Internet,Aggregator For Packaging Material,Mumbai,"B Capital, International Finance Corporation (IFC), Accel Partners and IDG Ventures",Private Equity,1873.74
2018-03-05,Disprz,IT,SaaS,Chennai,"IL&FS Private Equity, Kae Capital & Others",Seed / Angel Funding,212.925
2018-09-05,i3sysytems,Technology,AI product company For Health and Life Insurane Companies,Mumbai,"Unitus Ventures, Behram Vakil and Jerxis Vandrevala",Seed / Angel Funding,85.17
2018-11-05,Earth Food,Consumer Internet,Agri-tech,Pune,Rairah Corporation,Seed / Angel Funding,80.82633
2018-02-04,Fitternity,Consumer Internet,Online Fitness Discovey Platform,Mumbai,"Exfinity Venture, Saha fund Partners, Arihant Patni of Patni Family Office, Anjali Bansal, Shardul Amarchand Mangaldas, Satish Khanna and Taparia family office.",Private Equity,170.34
2018-02-04,Synctag,Technology,Social Media Anlaytics Platform,Coimbatore,Subhkam Ventures and Mohit Khadaria,Seed / Angel Funding,26.198292
2018-02-04,Benepik,Technology,Enhanced Employee Engagement Platform,Gurugram,"Vishal Bali, Yogesh Misra, Thomas Assessments and others",Seed / Angel Funding,0.0
2018-04-04,Varthana,Finance,Loans and Services To Affordable Private Schools in India,Bengaluru,"ChrysCapital, Existing investors, Elevar Equity, LGT Impact, Omidyar Network and Kaizen Private Equity also participated in the round",Private Equity,4684.35
2018-05-04,IndigoLearn,Ed-Tech,Online Education Platform,Hyderabad,"Maheshwar Peri, founder and chairman of career information portal Careers360, and Jamshed Jeejeebhoy, director at Byramjee Jeejeebhoy Pvt. Ltd were among the angels",Seed / Angel Funding,12.7755
2018-05-04,Vedantu,Ed-Tech,Interactive Online Tutoring Platform,Bangalore,"Accel Partners, Tiger Global And Others",Private Equity,851.7
2018-09-04,Kaleidofin,Fiinance,Digital Financial Services Platform,Chennai,Omidyar Network. Blume Ventures and Professor Shlomo Ben-Haim,Seed / Angel Funding,238.476
2018-09-04,Pipabella,Consumer Internet,Fashion Accessories Etailer,Mumbai,Fireside Ventures,Seed / Angel Funding,85.17
2018-09-04,Elemential,Technology,Blockchain Platform,Mumbai,"Matrix Partner, Amrish Rau, Investopad, Digital Currency Group, Hinduja Group, Lightspeed India, Eight Innovate, Amit Ranjan, Prashant Malik and others",Seed / Angel Funding,0.0
2018-10-04,Loanzen,Finance,Digital Lending Platform In Logistics,Bengaluru,Kae Capital Management,Seed / Angel Funding,0.0
2018-10-04,TravelTriangle,Consumer Internet,Online Travel Marketplace,Gurugram,"Fundamentum, SAIF Partners, Bessemer Venture Partners, RB investments & Others",Private Equity,1022.04
2018-12-04,Letsmd,Healthcare,Platform To Discover Healthcare Financing Options,Delhi,"SRI Capital, Waterbridge Ventures and ThinKuvate",Seed / Angel Funding,85.17
2018-12-04,AyeFinance,Finance,Online Lending Platform,Gurugram,"BlueOrchard Finance Ltd, Hinduja Leyland Finance and IntelleGrow",Debt Funding,391.782
2018-01-03,PharmEasy,Consumer Internet,Online Pharmacy Store,Mumbai,"Bessemer Venture Partners and Orios Venture Partners, JM Financials and MEMG",Private Equity,0.0
2018-01-03,Buddy4studdy,Consumer Internet,Online Scholarship Portal,Noida,CBA Capital and others,Private Equity,255.51
2018-01-03,Urban Ladder,E-Commerce,Online Furniture Store,Bengaluru,"Sequoia Capital, SAIF Partners and Kalaari capital",Private Equity,1022.04
2018-03-03,Kuvera,Consumer Internet,Online Financial Planning,Bengaluru,"Baskar Subramanian, Saket Kumar, Gaurav Suri and Ankit Kesarwani",Seed / Angel Funding,21.2925
2018-04-03,Gramophone,Technology,Agri-tech,Indore,InfoEdge,Seed/Angel Funding,85.17
2018-05-03,Wellthy,Healthcare,Therapeutics,Mumbai,"Ranjan Pai, Apoorva Patni, Beenext Ventures,GrowX Ventures",Private Equity,178.857
2018-05-03,MedGenome,Healthcare,"Genetic Screening, DNA Diagnostics Labs & Research Centers",Bengaluru,"HDFC Life, HDFC Asset Management",Private Equity,851.7
2018-05-03,Finova Capital,Consumer Internet,Online Lending,Jaipur,Sequoia Capital,Private Equity,511.02
2018-05-03,Hotelogix,Technology,Cloud based Online Hotel Management Software,Noida,"Vertex Ventures, Accel Partners and Saama Capital",Private Equity,425.85
2018-04-03,Livehealth,Consumer Internet,Health Service Aggregator Platform,Pune,Nexus Venture Partners,Seed / Angel Funding,93.687
2018-06-03,Ad2pro,Technology,"Creative Design, Brand, Media and Technology Platform Solutions",Chennai,Avendus Finance Pvt. Ltd,Debt Funding,826.149
2018-06-03,Coverfox,Consumer Internet,Online Insurance Aggregator,Mumbai,Aegon NV,Private Equity,647.292
2018-08-03,Pepperfry,Consumer Internet,Online Furniture Shopping Store,Mumbai,State Street Global Advisors,Private Equity,3270.528
2018-08-03,Magicpin,Consumer Internet,Hyperlocal Discovery,Gurugram,Trifecta Capital,Debt Funding,85.17
2018-12-03,HealthCare,Consumer Internet,Healthcare Aggregator,Mumbai,HR Fund,Seed / Angel Funding,85.17
2018-01-02,BigBasket,Consumer Internet,Online Grocery & Food Store,Bengaluru,"Alibaba, Helion Venture Partners, Bessemer Venture Partners, Ascent Capital",Private Equity,25551.0
2018-01-02,Zomato,Food and Beverages,Food Ordering and Restaurant Discovery,Gurugram,Ant Financials,Private Equity,17034.0
2018-05-02,Pratilipi,Publishing,E-Publishing,Bengaluru,Omidyar Network,Private Equity,366.231
2018-05-02,Asia Institute Of Medical Science,Healthcare,Super-specialty Hospital,Faridabad,CDC Group Plc,Private Equity,1788.57
2018-05-02,CollegeDekho,Consumer Internet,Online platform for Higher Education Services,Gurugram,"Man Capital LLP, Girnar Software, Others",Private Equity,170.34
2018-06-02,Foodmemories,Consumer Internet,Online Food Marketplace,Ahemdabad,"Bhavesh Manglani, Suraj Saharan, Darshan Upadhyay, Sanjay Notani & Others",Seed funding,0.0
2018-06-02,Healthi,Healthcare,Preventive Health Checkup,Bengaluru,Montane Ventures,Private Equity,264.027
2018-07-02,Swiggy,Food and Beverages,Online Food Delivery,Bengaluru,Naspers,Private Equity,8517.0
2018-08-02,Shape,Healthcare,"Online Portal for Diet,fitness and Beauty",Pune,Sandeep Mathur,Seed / Angle Funding,8517.0
2018-08-02,Icertis,Consumer Internet,Enterprise Contract Management Platform,Pune,Meritech Capital Partners,Private Equity,4258.5
2018-09-02,healthifyme,Healthcare,Mobile Weight Loss Coach,Bengaluru,Sistema Asia Fund,Private Equity,1022.04
2018-09-02,MedTel,Healthcare,Virtual health clinics,Bhubaneswar,British and Indian Governments,Private Equity,0.0
2018-09-02,Rupeek,Consumer Internet,Online Gold Loan,Bengaluru,"Accel Partners, Sequoia Capital",Private Equity,581.7111
2018-09-02,WebEngage,Technology,Marketing Cloud for consumer businesses,Mumbai,Social Capital,Private Equity,0.0
2018-12-02,Lendingkart,Finance,Online Lending Platform,Bengaluru,Fullerton Financial Holdings Pte Ltd & Others,Private Equity,7409.79
2018-12-02,Wydr,Consumer Internet,B2B Marketplace,Gurugram,"Bessemer Venture Partners, Stellaris Venture Partners, Axis Capital, Singapore, Jungle Venture Partners",Private Equity,0.0
2018-12-02,Cashify,E-Commerce,Online Selling,Gurugram,Trifecta Capital,Debt Funding,79.64153012999999
2018-02-01,CleverTap,Technology,Mobile App Analytics,Mumbai,"Recruit Holdings, Sequoia Capital India, Accel Partners",Angel / Seed Funding,0.0
2018-04-01,EarlySalary,Finance,Online Lending,Pune,Eight Roads Ventures India,Private,1337.169
2018-05-01,WOTU,E-commerce,Food and Beverages,Bengaluru,"Claris Capital, Mumbai Angels Network",Angel / Seed Funding,0.0
2018-08-01,DAAKI,E-commerce,Sports Nutrition Supplement etailer,Bengaluru,Rohan Agila,Angel / Seed Funding,0.0
2018-09-01,Lendingkart,Finance,Online Lending,Ahmedabad,Nederlandse Financierings-Maatschappij voor Ontwikkelingslanden N.V.,Debt Funding,400.299
2018-10-01,Tapzo,Technology,Personal Assistant,Bengaluru,RuNet & Other,Private Equity,164.3781
2018-10-01,Appario Retail Pvt Ltd.,E-commerce,Retail,Delhi,Amazon-Patni JV,Private Equity,1604.6028
2018-10-01,Samunnati,Finance,Agricultural Loan,Chennai,"responsAbility, Elevar Equity and Accel Partners",Private Equity,2001.495
