Date,Startup,Industry,Subvertical,City,Investors,Round,Amount
2017-03-04,Tyre Express,Technology,Enterprise IoT solutions For Tyre Performance,Mumbai,Rohitash Gupta,Seed Funding,0.0
2017-03-04,SmartCoin,Consumer Internet,Micro Lending platform,Bangalore,Unicorn India Ventures & Others,Private Equity,0.0
2017-04-04,WayCool,Food & Beverage,Fresh-Produce Distribution Platform,Chennai,Aspada Investments,Private Equity,229.959
2017-04-04,Perfios,Technology,Fin-Tech Solutions,Bangalore,Bessemer Venture Partners,Private Equity,519.537
2017-04-04,Whatfix,Technology,Interactive Tech-Support Guides,Bangalore,"Stellaris Venture Partners, Helion Venture Partners, Powerhouse Ventures, Gokul Rajaram, Girish Mathrubootham, Aneesh Reddy, Vispi Daver",Private Equity,314.2773
2017-04-04,ElastiRun,Technology,App based Logistics & Distribution platform,Pune,"Kalaari Capital, Norwest Venture Partners",Private Equity,596.19
2017-04-04,Trukky,Consumer Internet,Online Truck Aggregator & Booking platform,Ahmedabad,"Keyur Joshi, Pavan Bakeri",Seed Funding,42.585
2017-04-04,Konsult App,Consumer Internet,App based Doctor Consulting platform,New Delhi,"Koen Bouwers, Lomesh Agarwal, Jeroen Mensen, Pablo van den Bosch & Others",Seed Funding,42.585
2017-05-04,Credit Sudhaar,Consumer Internet,Credit Score Improvement platform,Mumbai,"Deepak Kulkarni, Sandeep Pangal",Seed Funding,0.0
2017-05-04,Fingerlix,Consumer Internet,Food Delivery Platform,Mumbai,Zephyr Peacock India,Private Equity,255.51
2017-05-04,DataWeave,Technology,Business Intelligence Solutions,Bangalore,"FreakOut Group, Blume Ventures, Herb Madan, WaterBridge Ventures",Private Equity,0.0
2017-06-04,Medwell Ventures,Healthcare,Home-Based Healthcare provider,Bangalore,"Mahindra Partners, Eight Roads Ventures, F-Prime Capital Partners",Private Equity,1788.57
2017-06-04,Mech Mocha,Consumer Internet,Mobile gaming startup,Bangalore,"Accel Partners, Shunwei Capital",Private Equity,425.85
2017-07-04,Startup Buddy,Consumer Internet,Startup Support Platform,Gurgaon,"YouWeCan Ventures,",Seed Funding,0.0
2017-07-04,QorQI,Healthcare,Online Healthcare provider,Noida,Paytm,Seed Funding,0.0
2017-07-04,Twenty Two Motors,Technology,Smart Scooter manufacturer,Gurgaon,"Ishwar Singh,Farhaan Shabbir",Seed Funding,0.0
2017-07-04,PharmEasy,eCommerce,Online Pharmacy,Mumbai,"Bessemer Venture Partners, Orios Venture Partners, Trifecta Capital,",Private Equity,1533.06
2017-08-04,WonderChef,eCommerce,Online marketplace for kitchen products,Mumbai,Labruyere Eberl\\xc3\\xa9,Private Equity,0.0
2017-08-04,FastFox,Consumer Internet,Online rental discovery platform,Gurgaon,"Lightspeed India Partners, Blume Ventures, CyberAgent Ventures, GrowX Ventures, IMJ Investment Partners",Private Equity,391.782
2017-10-04,Omnify,Technology,SaaS platform for SMEs,Bangalore,"Rajan Anandan, L.D Sharma, Saurabh Arora",Seed Funding,12.7755
2017-10-04,Capital Float,Consumer Internet,Online Lending Platform for SME,Bangalore,Mahindra and Mahindra Financial Services,Private Equity,195.891
2017-11-04,Ninjacart,eCommerce,B2B agri-marketing platform,Bangalore,"Accel Partners, Nandan Nilekani\\xe2\\x80\\x99s NRJN Trust, Mistletoe, Qualcomm Ventures, M&S Partners",Private Equity,468.435
2017-11-04,MergerWare,Technology,Software solutions for M&As,Bangalore,Philippe Bouchet,Seed Funding,8.517
2017-11-04,Sports Flashes,Consumer Internet,Online Sports portal & Mobile app,New Delhi,"Sushil Kumar, Sandeep Singh",Seed Funding,0.0
2017-12-04,Clovia,eCommerce,Online lingerie & Sleepwear etailer,New Delhi,"Ivycap Ventures Advisors, Singularity Ventures and Ravi Dhariwal",Private Equity,340.68
2017-12-04,Emiza,Logistics,Third Party Logistics provider,Mumbai,"Mayfield, Nishant Rao, Dileep Nath",Private Equity,383.265
2017-12-04,HackerEarth,Consumer Internet,Online Skill Assessment Platform,Bangalore,"DHI Group Inc, Prime Venture Partners, Beenext, Beenos, Digital Garage, BizReach",Private Equity,383.265
2017-12-04,Squadrun,Technology,Software-As-a-Service Platform,Noida,"Blume Ventures, Contrarian Capital, 91springboard, Emergent Ventures, Abstract Ventures, Anthill Ventures, Axilor Ventures",Private Equity,178.857
2017-12-04,Tinmen,Consumer Internet,Food Delivery Platform,Hyderabad,"MAPE Advisory Group, R Ramaraj, Corvus Ventures",Seed Funding,0.0
2017-12-04,ScoutMyTrip,Consumer Internet,Online Travel planner,Mumbai,Z Nation Lab,Seed Funding,0.0
2017-01-03,Ola,Consumer Internet,App based cab aggregator,Bangalore,SoftBank Group Corp,Private Equity,28106.1
2017-01-03,Belong,Consumer Internet,Online Jon Portal,Bangalore,Sequoia Capital India,Private Equity,851.7
2017-01-03,Seenit,Consumer Internet,AI based Fashion Search Portal,Kolkata,"Calcutta Angels Network (CAN), Augment Ventures",Seed Funding,0.0
2017-01-03,Paalak,ECommerce,Fresh Produce Selling portal,New Delhi,"Vishwadeep Bajaj, Harsh Kundra, Nandkumar Rane, LN Buddharaju, Anupam Tyagi",Seed Funding,0.0
2017-02-03,Celes Care,Consumer Internet,Women Healthcare & Information portal,Hyderabad,"Ventureast, Endiya Partners, Eight Roads Ventures, F-Prime Capital Partners",Private Equity,127.755
2017-02-03,Karomi,Technology,Packaging Artwork Management software,Chennai,Ideaspring Capital,Seed Funding,42.585
2017-02-03,Red Carpet,Consumer Internet,Micro Lending platform,Gurgaon,Lightspeed Venture Partners,Private Equity,212.925
2017-02-03,Kreate Konnect,Technology,End-to-End Seller e-commerce solutions Provider,Vadodara,Langoor,Seed Funding,0.0
2017-02-03,CreditMantri,Consumer Internet,Online Credit score & lending platform,Chennai,Quona Capital,Private Equity,647.292
2017-03-03,Lets Endorse,Consumer Internet,Online Ecosystem of social innovators,Bangalore,"Chandigarh Angels Network, Social Alpha and other unnamed angel investors",Seed Funding,0.0
2017-03-03,Tydy,Technology,Employee Onboarding and Engagement platform,Bangalore,"Bhupen Shah, Jayesh Parekh, Sanjay Sathe",Seed Funding,23.42175
2017-03-03,Nactus,Consumer Internet,Professional Tutors discovery & booking mobile app,Jaipur,"Sandeep Aggarwal, Gautam Chhaochharia, R Balachandar",Seed Funding,0.0
2017-03-03,Oho Shop,Technology,eCommerce Mobile App Builder,Ahmedabad,"Bennett, Coleman and Company Ltd",Private Equity,570.639
2017-03-03,Emojifi,Consumer Internet,Mobile App for live emoji,Hyderabad,Undisclosed angel investors,Seed Funding,0.0
2017-03-03,Paytm Marketplace,ECommerce,ECommerce Marketplace,Bangalore,Alibaba,Private Equity,17034.0
2017-04-03,iGenetics,Healthcare,Health Diagnostic Solutions,Mumbai,CDC Group Plc,Private Equity,1660.815
2017-06-03,Juno Clinic,Consumer Internet,Online Counseling Platform,Mumbai,Atul Nishar,Seed Funding,102.204
2017-06-03,Summerlabel,Consumer Internet,Fashion and Lifestyle discovery platform,Gurgaon,"Aneesh Seth, Tushar Mittal",Seed Funding,12.7755
2017-06-03,PickMe,Consumer Internet,Gadget Insurance & Repair Services platform,Mumbai,SIDBI Venture Capital Fund,Private Equity,152.4543
2017-07-03,Agrostar,Technology,Direct-to-Farmer Mobile-Based Retail platform,Pune,Accel Partners,Private Equity,851.7
2017-07-03,Zapr,Technology,"DSP, TV Analytics & Cross-Platform advertising",Bangalore,Star India Pvt Ltd,Private Equity,851.7
2017-07-03,Data Resolve,Technology,Cyber Security Solutions,Noida,IDFC Parampara Early Stage Opportunities Fund,Private Equity,85.17
2017-07-03,Book Servicing,Consumer Internet,Online Vehicle Services Booking platform,New Delhi,National Science and Technology Entrepreneurship Development Board,Seed Funding,2.5551
2017-07-03,Blowhorn,Consumer Internet,Intra-City Logistics provider,Bangalore,"IDG Ventures India, Michael & Susan Dell Foundation, Draper Associates, Unitus Seed Fund",Private Equity,310.8705
2017-08-03,Rivigo,Logistics,Technology Enabled Logistics Company,Gurgaon,Private Sector Banks (Debt Funding),Private Equity,1277.55
2017-08-03,PipeCandy,Technology,Intelligent Sales Prospecting Platform,Chennai,"IDG ventures, Axilor Ventures, Emergent Ventures, Indian Angel Network",Seed Funding,93.687
2017-08-03,Supr Daily,Consumer Internet,Subscription based Home Delivery Platform,Mumbai,Y Combinator,Seed Funding,10.2204
2017-08-03,Parentune,Consumer Internet,Online Community for Parents,Gurgaon,"Kae Capital, SEGNEL Ventures",Private Equity,0.0
2017-09-03,AppBrowzer,Consumer Internet,Instant Mobile Apps Store,Bangalore,Deepak Gurnani,Seed Funding,42.585
2017-09-03,MagicBricks,Consumer Internet,Online Real Estate Portal,Mumbai,Times Internet Ltd,Private Equity,383.265
2017-10-03,PeeBuddy,Healthcare,Female Hygiene product manufacturer,New Delhi,Indian Angel Network,Seed Funding,37.73031
2017-10-03,iOrderFresh,ECommerce,Online fresh fruits and grocery store,New Delhi,Singapore Angel Network,Seed Funding,0.0
2017-10-03,Lavelle Networks,Technology,SDN Solutions,Bangalore,Ideaspring Capital,Seed Funding,51.102
2017-10-03,PropertyShare,Consumer Internet,Fractional Proerty Ownership & Rental platform,Bangalore,"Asuka, Pravega Ventures, BEENEXT",Seed Funding,0.0
2017-02-02,Clodura,Technology,Intelligent Sales Assistant,Pune,Undisclosed Investors,Seed Funding,0.0
2017-03-02,Stockroom.io,Consumer Internet,Curated Platform for Developers,Hyderabad,"Satya D Sinha, Gyanendra Singh",Seed Funding,0.0
2017-06-02,Capital Float,Consumer Internet,Online lending platform,Bangalore,IFMR Capital Finance,Private Equity,212.925
2017-06-02,iManageMyHotel,Technology,Hotel Management Solution,Kolkata,Jaarvis Accelerator,Seed Funding,0.0
2017-07-02,Inner Hour,Consumer Internet,Online Counselling Platform,Mumbai,"Batlivala & Karani Securities, Venture Works",Seed Funding,38.3265
2017-07-02,Travel Triangle,Consumer Internet,Online travel agent marketplace,Noida,"RB Investments, SAIF Partners, Bessemer Venture Partners",Private Equity,851.7
2017-08-02,Wandertrails,Consumer Internet,"Online Travel, Adventure & Activities Portal",Bangalore,Earlsfield Capital,Seed Funding,85.17
2017-08-02,Zenatix,Technology,IoT Based Energy Monitoring & Control,Gurgaon,"pi Ventures, Blume Ventures",Private Equity,102.204
2017-08-02,Cartrade,Consumer Internet,Automobile Classifieds Portal,Mumbai,Temasek Holdings,Private Equity,4684.35
2017-08-02,MindYourFleet,Technology,Car Rental Software Solutions,Noida,"Japan Vyas, Tarun Adlakha",Seed Funding,0.0
2017-08-02,Edurev,Consumer Internet,Online Education Portal,Gurgaon,Facebook FB Start programme,Seed Funding,3.4068
2017-09-02,Voonik,ECommerce,Women Apparel & Lifestyle etailer,Bangalore,"RB Investments, Sequoia Capital",Private Equity,511.02
2017-09-02,1Crowd,Finance,Startup Crowd-funding platform,Mumbai,Ganesh Natarajan,Seed Funding,0.0
2017-09-02,Wooplr,ECommerce,Women Fashion Portal,Bangalore,"Sistema Asia Fund, Amereus Group, Helion Ventures",Private Equity,681.36
2017-10-02,48East,ECommerce,Online Food Delivery Platform,Bangalore,Al Dhaheri family,Private Equity,42.585
2017-10-02,Redesyn,Consumer Internet,Tech Enabler for Artists,Mumbai,ThinQbate,Seed Funding,0.0
2017-02-01,TaxSutra,Consumer Internet,Online Tax Filing platform,Pune,"TV Mohandas Pai, V Balakrishnan, PV Srinivasan",Seed Funding,31.17222
2017-03-01,TempoGo,Technology,IoT & SAAS Solutions for Transportation Industry,Panaji,K2 Capital,Seed Funding,70.26525
2017-03-01,GoFynd,ecommerce,Fashion ecommerce portal,Mumbai,"Anand Chandrasekaran, Rajiv Mehta, Ramakant Sharma",Seed Funding,0.0
2017-03-01,Vow Car Clinic,Consumer Internet,Online/App Based Car cleaning service provider,Gurgaon,Vishal Malik,Seed Funding,0.0
2017-04-01,LearnTron,Technology,Blended Learning Delivery App for Schools & Corporates,Chennai,Kae Capital,Seed Funding,0.0
2017-05-01,MobiDent,Consumer Internet,Dentist Appointments booking platform,Bangalore,DanGold Investment Corp,Private Equity,0.0
2017-05-01,Yostra,Technology,Healthcare Technology Solutions,Bangalore,"Marico Innovation Foundation (MIF), Villgro",Private Equity,0.0
2017-06-01,Leap India,Logistics,Supply Chain Solutions Provider,Mumbai,"India Nivesh Growth Fund, Sixth Sense, TCI Ventures",Private Equity,1107.21
2017-07-01,FreeCharge,Consumer Internet,Mobile Wallet,Mumbai,Jasper Infotech Pvt Ltd,Private Equity,4854.69
2017-09-01,TicketNew,Consumer Internet,Movie Ticket Booking platform,Chennai,Alibaba Pictures,Private Equity,2980.95
2017-10-01,Intelligence Node,Technology,SAAS Based Retail Analytics Solutions,Mumbai,BlackSoil Capital Pvt Ltd,Private Equity,68.136
2017-10-01,Securens,Technology,e-surveillance services provider,Mumbai,"Mayfield India, Trifecta Capital",Private Equity,425.85
2017-10-01,Loan Frame,Consumer Internet,Small Business Loans Marketplace platform,Gurgaon,"Vedanta Capital, William Campbell, Toos N Daruvala",Private Equity,191.6325
2017-10-01,DriveSkool,Consumer Internet,online marketplace for driving schools,Bangalore,Aavya Ventures,Seed Funding,0.0
2017-10-01,Medinfi,Consumer Internet,Doctor & Clinic Discovery portal,Bangalore,"Vinod Martin, Evan Lim, Kanchan Ghoshal, Ram Kumar Kakani",Seed Funding,8.517
2017-10-01,LensKart,eCommerce,Online eyewear retailer,Bangalore,Ronnie Screwvala,Private Equity,298.095
2017-11-01,InstaOffice,Consumer Internet,CoWorking Spaces booking platform,Gurgaon,"Zishaan Hayath, Karan Chellani, Mohit Satyan",Seed Funding,0.0
2017-12-01,Hansel.io,Consumer Internet,Real-time Mobile App Management Platform,Bangalore,"IDG Ventures, Endiya Partners",Private Equity,114.9795
2017-12-01,Square Yards,Consumer Internet,Property Search Aggregator platform,Gurgaon,"Lohia Group, Andre Hoffman",Private Equity,851.7
2017-02-01,99Games,Technology,Mobile Game Developer Studio,Udupi,Dream Incubator,Seed Funding,0.0
2016-01-12,SidQam,Technology,Healthcare Software System,Noida,"SQue Capital, Grace Capital Ventures, Soham Vencaps",Private Equity,102.204
2016-01-12,India Lends,Consumer Internet,Online Instant personal Loan provider,New Delhi,"DSG Consumer Partners, American Express Ventures, Cyber Carrier VC, AdvantEdge Partners",Private Equity,340.68
2016-01-12,Slide App,Consumer Internet,Lock screen Rewards mobile app,New Delhi,Songhyun Investment,Private Equity,306.612
2016-02-12,Badiyajobs,Consumer Internet,Entry-Level job Seekers platform,New Delhi,Undisclosed,Seed Funding,8.517
2016-02-12,Streo,Consumer Internet,Live Music Streaming App,Bangalore,"GEMs Advisory, Quarizon",Seed Funding,0.0
2016-02-12,TYGR,Technology,Transport and logistics mobile App,Mumbai,Franchise India,Private Equity,255.51
2016-05-12,Mr Hot Foods,Consumer Internet,Online Food Ordering & Delivery Portal,Indore,IvyCamp Ventures,Seed Funding,0.0
2016-05-12,UrDoorStep,eCommerce,Online Grocery Store,Bangalore,Lakshmi Vilas Bank & undisclosed HNIs,Private Equity,119.238
2016-05-12,ONN Bikes,eCommerce,"On-demand, self-drive bike rental platform",Mumbai,Grace Capital Ventures,Seed Funding,0.0
2016-06-12,Diro Labs,Consumer Internet,Mobile Contacts Management app,New Delhi,Info Edge (India),Seed Funding,12.51999
2016-06-12,THB,Technology,Clinical research and data analytics,Gurgaon,"Ajith Sukumaran, Currae Healthtech Fund",Seed Funding,0.0
2016-07-12,LookAtMe,Consumer Internet,Mobile App based Fashion Network,Singapore,Eros Labs,Seed Funding,0.0
2016-07-12,Netree,eCommerce,Mobile-only Retailers Engagement Solution,New Delhi,"The Chennai Angels, LetsVenture",Seed Funding,0.0
2016-07-12,BookEventz,Consumer Internet,"Venue, Events Booking platform",Mumbai,Investors from Mumbai Angels & LetsVenture,Seed Funding,0.0
2016-07-12,Tailslife,Consumer Internet,Pet Parenting mobile app,Bangalore,"Mohan Kumar, V. Balakrishnan",Seed Funding,0.0
2016-07-12,Revv,Consumer Internet,Self-Driven Car Services booking portal,New Delhi,Edelweiss Private Equity,Private Equity,766.53
2016-07-12,WealthApp,Consumer Internet,Online Investment Advisory platform,Bangalore,"Venk Krishnan, MJ Aravind, Vikram Kotak, Jayant Davar,\\xc2\\xa0 Ramkumar Nishtal, Arjun Sharmaa",Seed Funding,37.4748
2016-07-12,Vehico,Technology,Connected Transportation solutions,Bangalore,"Calcutta Angel Network, Appliyifi",Seed Funding,0.0
2016-08-12,Zest Money,Consumer Internet,Online Consumer Lending platform,Mumbai,PayU,Private Equity,553.605
2016-08-12,GoMechanic,Consumer Internet,Online Car servicing Booking platform,Gurgaon,Venture Catalysts,Seed Funding,21.2925
2016-09-12,Stalk Buy Love,eCommerce,Fashion Apparel eTailer,New Delhi,Kalaari Capital,Private Equity,511.02
2016-09-12,Nykaa,eCommerce,Beauty Products etailer,Mumbai,Max Ventures and Industries,Private Equity,0.0
2016-09-12,Wittyparot,Technology,Content Management & Productivity platform,Bangalore,Mumbai Angels,Seed Funding,38.3265
2016-09-12,NeuroEquilibrium,Technology,Health-Tech platform,Jaipur,Unicorn India Ventures,Seed Funding,21.2925
2016-12-12,Xseed Education,Technology,Education & learning Tech platform,Bangalore,Verlinvest SA,Private Equity,851.7
2016-12-12,Rupaiya Exchange,Consumer Internet,P2P Lending platform,New Delhi,Undisclosed Investors,Seed Funding,17.034
2016-12-12,Doctor Insta,Consumer Internet,Online Doctor Consulting platform,Gurgaon,RoundGlass Partners,Private Equity,170.34
2016-12-12,UrbanPiper,Consumer Internet,Self-Branded Websites & Apps for Ecommerce,Bangalore,"Axilor, undisclosed investors",Seed Funding,0.0
2016-12-12,Fresh Food Concepts,Food & Beverage,Cold Press Juice manufacturer & seller,New Delhi,"Siddhartha Gupta, Ashvin Chadha",Seed Funding,170.34
2016-01-11,PickMyLaundry,Consumer Internet,On-Demand Washing & Dry Cleaning Services,New Delhi,"Kedar Lele, GHV Accelerator",Seed Funding,17.034
2016-02-11,FreshDesk,Consumer Internet,SAAS Based HelpDesk Services,Chennai,"Sequoia Capital India, Accel Partners",Private Equity,4684.35
2016-02-11,LaundryAnna,Consumer Internet,On-Demand Washing & Dry Cleaning Services,Bangalore,Undisclosed Investors,Seed Funding,12.7755
2016-02-11,LetsMD,Consumer Internet,Healthcare Services Comparison Platform,New Delhi,"Calcutta Angels Network, LetsVenture, Anupam Mittal, Currae Healthtech Fund",Seed Funding,0.0
2016-02-11,Sattviko,Food & Beverage,Health Food Restaurant Chain,New Delhi,"Raman Roy, Ashish Gupta, Yogesh Andlay, Vaibhav Jain",Seed Funding,0.0
2016-03-11,Zarget,Technology,SaaS-based web optimisation and marketing platform,Chennai,Sequoia India,Private Equity,511.02
2016-03-11,DoSelect,Consumer Internet,Skill Showcasing platform,Bangalore,"3one4 Capital, Mumbai Angels, Aarin Capital",Seed Funding,0.0
2016-03-11,EasyPolicy,Consumer Internet,Online insurance Portal,Noida,"Unilazer Ventures,",Private Equity,851.7
2016-04-11,Browntape,Technology,cloud-based software solutions company,Goa,Gati Ltd,Private Equity,0.0
2016-04-11,Connect India,Logistics,Last mile Delivery Network,Bangalore,Aavishkaar Venture Management,Private Equity,85.17
2016-04-11,Corseco,Technology,AI-based Software as a Service Solution provider,New Delhi,"Ameera Shah, Vivek Bhargava",Seed Funding,12.7755
2016-04-11,vImmune,Consumer Internet,Immunisation Management Platform,Bangalore,Undisclosed investor,Seed Funding,0.0
2016-04-11,The Gourmet Jar,eCommerce,Gourmet Food etailer,Noida,Chandigarh Angels Network,Seed Funding,0.0
2016-05-11,Medzin,eCommerce,Online ordering & Delivery of medicines,New Delhi,A M Sikander,Seed Funding,3.83265
2016-05-11,Bizongo,eCommerce,Packaging Material Marketplace,Mumbai,"IDG Ventures, Accel Partners",Private Equity,255.51
2016-07-11,Rivigo,Technology,Technology based Logistics platform,Gurgaon,Warburg Pincus,Private Equity,6387.75
2016-07-11,JustRide,Consumer Internet,Online Car Sharing platform,Mumbai,"Justin Kan, Qasar Younis, Paul Bucche, Susa Ventures, Kima Ventures, Axan Venture, SCM Holdings",Private Equity,255.51
2016-09-11,IIM Jobs,Consumer Internet,Online Job Portal,New Delhi,India Quotient,Private Equity,170.34
2016-09-11,Square Yards,Consumer Internet,Online Property Search Portal,Gurgaon,ADAG Reliance Private Equity,Private Equity,1022.04
2016-10-11,GolfLAN,Consumer Internet,Golf Session Online Bookings platform,New Delhi,"YourNest Angel Fund, iSON",Private Equity,85.17
2016-10-11,Yottaasys,Technology,Data Sciences platform,Bangalore,Gleevoaz Ventures,Private Equity,0.0
2016-10-11,Tone Tag,Technology,Contactless Payment Solution,Bangalore,"Arun Seth, T.V. Mohandas Pai, Anand Chandrasekaran, Deepak Ghaisas",Private Equity,0.0
2016-11-11,Life in Control,Consumer Internet,Online Diabetes Management platform,Gurgaon,RoundGlass Partners,Private Equity,0.0
2016-03-10,MeraKisan,eCommerce,Fruit & vegetable eTailer,Bangalore,Mahindra Univeg,Seed Funding,0.0
2016-03-10,Mystifly,Consumer Internet,Airline Ticket Aggregator,Bangalore,Recruit Holdings,Private Equity,425.85
2016-03-10,HelpChat,Consumer Internet,AI Powered Content & Commerce platform,Bangalore,"American Express Ventures, Sequoia Capital",Private Equity,0.0
2016-03-10,Uniphore,Technology,Speech Recognition Solutions,Chennai,"IDG Ventures, Indian Angel Network (IAN), YourNest Angel Fund",Private Equity,170.34
2016-03-10,World Art Community,eCommerce,Art & Craft Marketplace,Gurgaon,Viraj Tyagi & Others,Seed Funding,17.034
2016-04-10,Giftxoxo,eCommerce,Online Gifting platform,Bangalore,Mahindra Holidays & Resorts India Ltd,Private Equity,38.3265
2016-04-10,Bharat Bazaar,eCommerce,Online B2B Marketplace,Mumbai,"BeeNext, TV Mohandas Pai, Kunal Shah, Sandeep Tandon",Seed Funding,0.0
2016-04-10,GOQii,Consumer Internet,Health & Fitness Wearable Device,Mumbai,Ratan Tata,Private Equity,0.0
2016-04-10,India Gifts Portal,eCommerce,Online Gifting platform,Noida,"Naveen Arya, Tarun Joshi",Private Equity,170.34
2016-04-10,Moglix,eCommerce,Industrial & Home products marketplace,Noida,"Accel Partners, Jungle Ventures, SeedPlus",Private Equity,357.714
2016-04-10,NetLinx,Consumer Internet,Internet Service Provider,Hyderabad,"Xchange Investors NV, TransGlobal FZC",Private Equity,255.51
2016-04-10,Scandid,Consumer Internet,Product Shopping Comparison App,Pune,3One4 Capital,Private Equity,0.0
2016-04-10,Remitr,Consumer Internet,Foreign Currency Payments Platform,Mumbai,"Vijay Shekhar Sharma, Pravin Gandhi,\\xc2\\xa0 Smart Start Fund; Kunal Shah,\\xc2\\xa0 Sandeep Tandon, Vishal Gondal, & Others",Seed Funding,85.17
2016-04-10,InnerChef,Consumer Internet,Online food ordering platform,Gurgaon,"Mistletoe, M&S Partners",Private Equity,212.925
2016-04-10,AppsDaily,Consumer Internet,"Mobile Phone Theft, Damage Protection platform",Mumbai,"Zodius Capital, Kalaari Capital, Qualcomm Ventures, Russian venture capital fund Ru-Net, Mumbai Angels",Private Equity,319.3875
2016-05-10,MuhurtMaza,Consumer Internet,Online Puja Booking Service,Pune,Undisclosed Investor,Seed Funding,0.0
2016-05-10,Azuro,Consumer Internet,Rental Property Finder platform,Mumbai,"White Unicorn Ventures, Kae Capital, Mumbai Angels",Private Equity,0.0
2016-05-10,NeuroSynaptic,Technology,Remote Healthcare Delivery Solutions,Bangalore,"Indian Angel Network, Healthsquad, Axilor Ventures",Private Equity,0.0
2016-05-10,UE LifeSciences,Technology,Mobile Health Technology Solutions,Mumbai,"Kiran Mazumdar-Shaw, Unitus Seed Fund",Private Equity,102.204
2016-06-10,FindmeaShoe,Consumer Internet,Footwear Recommendation App,Bangalore,Ventureast Fund Advisors,Seed Funding,0.0
2016-06-10,RealBox,Technology,Data Sciences Platform,Noida,Hyderabad Angels,Seed Funding,25.551
2016-06-10,Sportido,Consumer Internet,Sports Discovery platform,Noida,Sumpoorna Group,Seed Funding,0.0
2016-06-10,GoZefo,eCommerce,Used Furniture & Appliances Marketplace,Bangalore,"Helion Venture Partners, BeeNext",Private Equity,89.4285
2016-07-10,RayIOT,Technology,Baby Monitoring Devices manufacturer,Bangalore,HAX Accelerator,Seed Funding,8.517
2016-07-10,KOOH Sports,Technology,Sports Training & Technology,Mumbai,"HDFC, Faering Capital, Elevate Sports",Private Equity,187.374
2016-07-10,Flexiloans,Consumer Internet,Online Funds Raising Platform,Mumbai,"Sanjay Nayar, Vikram Sud, Anil Jaggia, Narayan Seshadri",Private Equity,1277.55
2016-07-10,Sibia Analytics,Technology,Marketing & Customer Analytics Solutions,Kolkata,Radhakrishnan Natarajan & Others,Seed Funding,0.0
2016-10-10,Vithi.com,eCommerce,Online Hair Extension etailer,New Delhi,undisclosed investor,Seed Funding,31.93875
2016-11-10,Yupp TV,Consumer Internet,Internet-based TV streaming service provider,Bangalore,Emerald Media,Private Equity,4258.5
2016-11-10,Deyor Camps,Consumer Internet,Branded Camping location Aggregator,Gurgaon,"Nitin Passi, Manickam Mahalingam, Udaan Angels, Rajesh Arora, Arkas Industries",Seed Funding,42.585
2016-12-10,ZipLoan,Consumer Internet,online lending platform,New Delhi,"GrowX Ventures, Sunil Kalra, Arun Venkatachalam,\\xc2\\xa0 Badal Malick",Seed Funding,0.0
2016-01-09,Mad Street Den,Technology,Artificial Intelligence platform,Chennai,"Sequoia India, Exfinity Ventures, growX ventures,",Private Equity,0.0
2016-01-09,Mihup,Technology,Personal Digital Assistant,Kolkata,Accel Partners,Private Equity,570.639
2016-01-09,Renowala,eCommerce,Home Improvement Marketplace,Hyderabad,Pradeep Dhobale,Seed Funding,0.0
2016-01-09,Lucideus,Technology,IT Risk Assessment and Digital Security Services provider.,New Delhi,Amit Choudhary,Seed Funding,0.0
2016-04-09,Trackbizz,Technology,Field Force Automation System,Kochi,Grasshoppers,Private Equity,0.0
2016-05-09,Social Quotient,Technology,Platform for Social Causes,Mumbai,"Anita Dongre, Yash Dongre, Milind Sarwate",Seed Funding,0.0
2016-05-09,Stalk Buy Love,eCommerce,Fashion Apparel eTailer,New Delhi,William Bissel,Seed Funding,0.0
2016-06-09,eShakti,eCommerce,Women\xe2\x80\x99s Fashion Apparel eTailer,Chennai,"Infina Finance Pvt. Ltd, Uday Kotak",Private Equity,114.9795
2016-06-09,CheersOye!,Consumer Internet,Online Gift Vouchers platform,Mumbai,Undisclosed Investors,Seed Funding,42.585
2016-06-09,Lenskart,eCommerce,Online Eyewear eTailer,New Delhi,PremjiInvest,Private Equity,0.0
2016-06-09,BigStylist,Consumer Internet,Hyperlocal doorstep Beauty Services provider,Mumbai,Info Edge (India) Ltd,Private Equity,76.653
2016-07-09,Zilingo,eCommerce,Online Fashion Retailer,Bangalore/ Bangkok,"Venturra Capital, Sequoia India, Susquehanna International Group.\\xc2\\xa0 Wavemaker Partners, Beenext, Beenos, Digital Garage",Private Equity,681.36
